{"checks":[{"binding":{"attempt":1,"criteria_sha256":"b35e2f20d75e208b100ed2ca3f1a7a404159902c676b7d41a70abef9489fc895","feature_id":"F001","run_id":"7d73c00531d0497996a014a2ba4dfa55","snapshot_sha256":"701a6feb0defd1dbfec36a4b2d443c319cb255dd5f5bda8831377f51a4fc9e52"},"command":{"argv":["./init.sh"],"timeout_seconds":600},"exit_code":0,"launch_error":"","source":"runner-subprocess-v1","stderr":{"path":"check-0.stderr","sha256":"e3b0c44298fc1c149afbf4c8996fb92427ae41e4649b934ca495991b7852b855"},"stdout":{"path":"check-0.stdout","sha256":"18b69e27a965f158900f6773fbca25ef7783699f3d9e29711bc55c213c77ebc5"},"timed_out":false}],"evaluation":{"binding":{"attempt":1,"criteria_sha256":"b35e2f20d75e208b100ed2ca3f1a7a404159902c676b7d41a70abef9489fc895","feature_id":"F001","run_id":"7d73c00531d0497996a014a2ba4dfa55","snapshot_sha256":"701a6feb0defd1dbfec36a4b2d443c319cb255dd5f5bda8831377f51a4fc9e52"},"criteria":[{"evidence":["init.sh uses set -eu and test \"$(cat marker.txt)\" = ready before echo FIXTURE_OK.","marker.txt contains ready followed by a newline.","runs/7d73c00531d0497996a014a2ba4dfa55/check-0.json records exit_code 0 without timeout or launch error.","Current-run check-0.stdout contains FIXTURE_OK; stdout and stderr hashes match the recorded evidence.","Independent evaluator execution of ./init.sh exited 0 and printed FIXTURE_OK."],"index":0,"reason":"Project-root ./init.sh checks marker.txt equals ready before printing FIXTURE_OK; independent execution exited zero and printed FIXTURE_OK.","status":"pass"}]},"evaluator_command":{"binding":{"attempt":1,"criteria_sha256":"b35e2f20d75e208b100ed2ca3f1a7a404159902c676b7d41a70abef9489fc895","feature_id":"F001","run_id":"7d73c00531d0497996a014a2ba4dfa55","snapshot_sha256":"701a6feb0defd1dbfec36a4b2d443c319cb255dd5f5bda8831377f51a4fc9e52"},"command":{"argv":["/opt/homebrew/opt/python@3.14/bin/python3.14","/private/var/folders/ww/wrxzkc9n7rs60hbt_g7mgcl40000gn/T/harness-provider-smoke-4vnml0wm/scripts/completion_evaluator.py","/private/var/folders/ww/wrxzkc9n7rs60hbt_g7mgcl40000gn/T/harness-provider-smoke-4vnml0wm","7d73c00531d0497996a014a2ba4dfa55"],"timeout_seconds":3600},"exit_code":0,"launch_error":"","source":"runner-subprocess-v1","stderr":{"path":"evaluator-0.stderr","sha256":"e3b0c44298fc1c149afbf4c8996fb92427ae41e4649b934ca495991b7852b855"},"stdout":{"path":"evaluator-0.stdout","sha256":"3a2492341c259f8a11f8fe70e6ec757efe4d6c40b35d290e73df35673f0841a9"},"timed_out":false},"role_boundary":{"boundary_json":"0979d7e14892cd29f0b78a1be76abee4d3429599518ef4a48f1191819e5a01fd","boundary_required_json":"a5b27b3e65fcd18e3086a1b63b342617efdd8b1834617319e00a32a5f8d2ed78","changes_json":"720064296e80e6f34c40305b9dcb639c8aa5ba9886e8fecb8ff6a9a4fa2c00ee","scope_json":"1af6e77c9ba15b7a2e8b707016558c18ce078579099e5a26980c715d5f2ca7ed","version":1},"run":{"attempt":1,"contract":{"acceptance":["Project-root ./init.sh exits zero and prints FIXTURE_OK by verifying marker.txt equals ready."],"description":"Verify the existing fixture marker through init.sh.","id":"F001","title":"Smoke recovery"},"criteria_sha256":"b35e2f20d75e208b100ed2ca3f1a7a404159902c676b7d41a70abef9489fc895","feature_id":"F001","required_commands":[{"argv":["./init.sh"],"timeout_seconds":600}],"run_id":"7d73c00531d0497996a014a2ba4dfa55","schema_version":1,"snapshot":{"entries":[{"index":[],"kind":"file","mode":420,"path":"AGENTS.md","sha256":"962480d0f6e4b39baea16ad1ed01693a4aad0f2693afbd56698c812f55674179"},{"index":[],"kind":"file","mode":420,"path":"agent-provider.json","sha256":"ec0de19d65dd129c284cb92642542ee25d081336a78809daf6be0ddf509cf929"},{"index":[],"kind":"file","mode":420,"path":"completion-policy.json","sha256":"22f26a7ec7033998fe6202594d8e1ec0ff4650696dd54b6057b1272cc0e907c3"},{"index":[],"kind":"file","mode":493,"path":"init.sh","sha256":"1beb1cbd4b7eeb4ec1400b8226f883f6fbf284e5ba7031f0be963bc6d93b3816"},{"index":[],"kind":"file","mode":420,"path":"marker.txt","sha256":"ed1a545bb85e55816bbf9566b028b2a0bc456b88f49f6f266c0401048824194b"},{"index":[],"kind":"file","mode":493,"path":"orchestrator.py","sha256":"186dbf772bc04b076db25720ee5fdc3a7055619fd345e20d29f7488863574fba"},{"index":[],"kind":"file","mode":420,"path":"prompts/continue.md","sha256":"8c9d214ae020ccfe346c6a6888bad7daa775c6d2993a5b8f915e68a343f7f54d"},{"index":[],"kind":"file","mode":420,"path":"prompts/evaluate.md","sha256":"b23ac4485353e7e6e6848fad6ce1755eedacd18ed0c1449d2768525e635e7b9e"},{"index":[],"kind":"file","mode":420,"path":"prompts/plan.md","sha256":"c3b9bc6a8d2da152339180e3dc7e0fe9e1ef8912c252bac1b16874f94b566315"},{"index":[],"kind":"file","mode":420,"path":"prompts/work-fast.md","sha256":"9340557a8e0e94c71b9524aba1ef0e48995774aab731cdac14daecec3461964a"},{"index":[],"kind":"file","mode":420,"path":"prompts/work.md","sha256":"ccdf3d1053bf507e22b5defb31a15294dc1b8b1937df2b2d8bee50f683b0b7b8"},{"index":[],"kind":"file","mode":420,"path":"schemas/evaluation.schema.json","sha256":"96f0672f2af581ff567c836d6bad33c99ef00406847126138e1f76728aa8f198"},{"index":[],"kind":"file","mode":420,"path":"schemas/feature_list.schema.json","sha256":"b65687a2ef6b09943873625db61d5ddb4db93963e2fbd7c7447c2798bf62bb51"},{"index":[],"kind":"file","mode":420,"path":"schemas/receipt.schema.json","sha256":"5fdf0f631696b605e2404609749c810469e61f46a5dab61b371e2491191e640d"},{"index":[],"kind":"file","mode":420,"path":"schemas/run.schema.json","sha256":"9c0658d75e8de32fba3f99e9ce658df797b172d29371d3bbec86bf68d03e360d"},{"index":[],"kind":"file","mode":420,"path":"scripts/__pycache__/completion.cpython-314.pyc","sha256":"db56b951e93da9968983e995da48f16b7f44417d31c55fd2284f0df6fd6b4724"},{"index":[],"kind":"file","mode":420,"path":"scripts/__pycache__/completion_evaluator.cpython-314.pyc","sha256":"1aac904fe99f6503b20556fee9bf5795d9306ef14dfce2d8dc2ae4d7db0c470d"},{"index":[],"kind":"file","mode":420,"path":"scripts/__pycache__/human-eval.cpython-314.pyc","sha256":"340e85ba963613da926aba5b99e2992ddf54e652197ae814d53331d956036920"},{"index":[],"kind":"file","mode":420,"path":"scripts/__pycache__/role_boundary.cpython-314.pyc","sha256":"18ea9d942979d9cc41e6de74b0d5d69c38959f59f7883ee743e17aab21c123f3"},{"index":[],"kind":"file","mode":420,"path":"scripts/__pycache__/run_evidence.cpython-314.pyc","sha256":"41f1ebfca37eaf8d81b244692b656d274b62167a8c9c07466ff2584807b240ce"},{"index":[],"kind":"file","mode":420,"path":"scripts/__pycache__/smoke-completion-provider.cpython-314.pyc","sha256":"f411072f7ba14788e21ba7d1acbbfa3b3e404e0fc957c3472e1465d10882abeb"},{"index":[],"kind":"file","mode":420,"path":"scripts/__pycache__/state_store.cpython-314.pyc","sha256":"575265ed0006d572a80bace8dbefa84bcb460e2176fc685373804a3f933bf320"},{"index":[],"kind":"file","mode":493,"path":"scripts/check-evaluator-evidence.sh","sha256":"38ae5908e4472a42e395c54a4afaf09dfc12229ed8c048c8ae318584ed48b550"},{"index":[],"kind":"file","mode":493,"path":"scripts/check-failure-domains.sh","sha256":"de918bb12da4adabe816ea724c7a74bfaad843141ec28e88d7bb059760e50706"},{"index":[],"kind":"file","mode":493,"path":"scripts/clean-state.py","sha256":"1a511c3e9189dd84e856acd9f7103c0b8c7cc5894e9ac5c1166b39f4adc2fb8e"},{"index":[],"kind":"file","mode":420,"path":"scripts/completion.py","sha256":"55b6897a4910fd83700c03dd758d628b7da927c6874c51e78732ee574c26513c"},{"index":[],"kind":"file","mode":420,"path":"scripts/completion_evaluator.py","sha256":"a05d4110d1f95105d116fb930988862dbde30bf1a5202515b1fe09abe6268996"},{"index":[],"kind":"file","mode":493,"path":"scripts/human-eval.py","sha256":"148e14dee5311b4b98d8617978413fdf8762f8a21076287d7a12e5de2f17e1cd"},{"index":[],"kind":"file","mode":493,"path":"scripts/init.sh","sha256":"b72b007d588293e7cb9512a53d333f2ef96b88693410162afef86112efba7c6d"},{"index":[],"kind":"file","mode":420,"path":"scripts/role_boundary.py","sha256":"6827aeaa57010d2cdbc7c5e13bfbbbc712f6b8eef127898a14426ffcdc35d175"},{"index":[],"kind":"file","mode":493,"path":"scripts/run-agent-provider.py","sha256":"3fb4322c81027a40621a61a22af5211968ec982ddcdac97c0fab0a2919973d74"},{"index":[],"kind":"file","mode":493,"path":"scripts/run-coding-agent.sh","sha256":"386f4813de9ed141e426589b26e575b454c8e157fc2c72bb1e94596d0397fe1b"},{"index":[],"kind":"file","mode":493,"path":"scripts/run-evaluator-agent.sh","sha256":"6611a4088bb823a1c7e41947aea3859299f8e871f2865e2615da852416f6b7bc"},{"index":[],"kind":"file","mode":420,"path":"scripts/run_evidence.py","sha256":"1be676c9a831728095adf9974397140eb36dbc1810aaaf0f4f8e3869accdebde"},{"index":[],"kind":"file","mode":420,"path":"scripts/smoke-completion-provider.py","sha256":"acd2c1a0c52b51fb12e50cd417ea7bb7044175cb13fce4bc1a555426f4f737cf"},{"index":[],"kind":"file","mode":420,"path":"scripts/state_store.py","sha256":"aa2189112812ac93d3d3030e0f39f4ed68599e501012e1a4bde3d1e1014ec6ee"},{"index":[],"kind":"file","mode":493,"path":"scripts/summarize-progress.sh","sha256":"9b244c5cc3c194164a71b474cfcbc202d891915b6f83341997e31eafd7725bc9"},{"index":[],"kind":"file","mode":493,"path":"scripts/summarize-runs.sh","sha256":"15e88ce08aacc040350e3abead5267c8f5694d82de819a0636dc829b00fca0fc"},{"index":[],"kind":"file","mode":493,"path":"scripts/validate-feature.sh","sha256":"e54de27390f70a1cc920181af05fd6d54bf1113eb0e9a428020bc87033860964"},{"index":[],"kind":"file","mode":493,"path":"scripts/validate-state.py","sha256":"22d58e962aff13647e67506a2a1ddd9d8ccd88e18082f66a2652342a0dea4dd7"}],"layout":"visible","policy":"git-source-v1","sha256":"701a6feb0defd1dbfec36a4b2d443c319cb255dd5f5bda8831377f51a4fc9e52"}},"schema_version":1,"sha256":"535c7fae3afee39d4f33c53b1ebdd7ae460b074b55a58d08435b795275d2cd8c"}
