{"checks":[{"binding":{"attempt":1,"criteria_sha256":"b35e2f20d75e208b100ed2ca3f1a7a404159902c676b7d41a70abef9489fc895","feature_id":"F001","run_id":"3071ac1cfa4c4571b8701b20182fb85c","snapshot_sha256":"ab9fa229a50118c5e8e47a8f4589166fa6890c06a4173800b8593af09352f6e6"},"command":{"argv":["./init.sh"],"timeout_seconds":600},"exit_code":0,"launch_error":"","source":"runner-subprocess-v1","stderr":{"path":"check-0.stderr","sha256":"e3b0c44298fc1c149afbf4c8996fb92427ae41e4649b934ca495991b7852b855"},"stdout":{"path":"check-0.stdout","sha256":"18b69e27a965f158900f6773fbca25ef7783699f3d9e29711bc55c213c77ebc5"},"timed_out":false}],"evaluation":{"binding":{"attempt":1,"criteria_sha256":"b35e2f20d75e208b100ed2ca3f1a7a404159902c676b7d41a70abef9489fc895","feature_id":"F001","run_id":"3071ac1cfa4c4571b8701b20182fb85c","snapshot_sha256":"ab9fa229a50118c5e8e47a8f4589166fa6890c06a4173800b8593af09352f6e6"},"criteria":[{"evidence":["init.sh uses set -eu and test \"$(cat marker.txt)\" = ready before echo FIXTURE_OK.","marker.txt contains ready followed by a newline.","Independent project-root ./init.sh execution returned exit code 0 and stdout FIXTURE_OK.","runs/3071ac1cfa4c4571b8701b20182fb85c/check-0.json records exit_code 0, no timeout, and no launch error; check-0.stdout contains FIXTURE_OK and check-0.stderr is empty. Both log hashes match.","All snapshot file hashes and modes match run.json."],"index":0,"reason":"Project-root ./init.sh verifies marker.txt equals ready before printing FIXTURE_OK; independent execution exited zero. The frozen criterion is satisfied. Referenced general rubric and docs are absent from this fixture.","status":"pass"}]},"evaluator_command":{"binding":{"attempt":1,"criteria_sha256":"b35e2f20d75e208b100ed2ca3f1a7a404159902c676b7d41a70abef9489fc895","feature_id":"F001","run_id":"3071ac1cfa4c4571b8701b20182fb85c","snapshot_sha256":"ab9fa229a50118c5e8e47a8f4589166fa6890c06a4173800b8593af09352f6e6"},"command":{"argv":["/opt/homebrew/opt/python@3.14/bin/python3.14","/private/var/folders/ww/wrxzkc9n7rs60hbt_g7mgcl40000gn/T/harness-provider-smoke-pqblh6sn/scripts/completion_evaluator.py","/private/var/folders/ww/wrxzkc9n7rs60hbt_g7mgcl40000gn/T/harness-provider-smoke-pqblh6sn","3071ac1cfa4c4571b8701b20182fb85c"],"timeout_seconds":3600},"exit_code":0,"launch_error":"","source":"runner-subprocess-v1","stderr":{"path":"evaluator-0.stderr","sha256":"e3b0c44298fc1c149afbf4c8996fb92427ae41e4649b934ca495991b7852b855"},"stdout":{"path":"evaluator-0.stdout","sha256":"1bd5c7c5493efb943498911736e3aca404aa5dd6fefa718cf87e386d51474038"},"timed_out":false},"run":{"attempt":1,"contract":{"acceptance":["Project-root ./init.sh exits zero and prints FIXTURE_OK by verifying marker.txt equals ready."],"description":"Verify the existing fixture marker through init.sh.","id":"F001","title":"Smoke recovery"},"criteria_sha256":"b35e2f20d75e208b100ed2ca3f1a7a404159902c676b7d41a70abef9489fc895","feature_id":"F001","required_commands":[{"argv":["./init.sh"],"timeout_seconds":600}],"run_id":"3071ac1cfa4c4571b8701b20182fb85c","schema_version":1,"snapshot":{"entries":[{"index":[],"kind":"file","mode":420,"path":"AGENTS.md","sha256":"962480d0f6e4b39baea16ad1ed01693a4aad0f2693afbd56698c812f55674179"},{"index":[],"kind":"file","mode":420,"path":"agent-provider.json","sha256":"ec0de19d65dd129c284cb92642542ee25d081336a78809daf6be0ddf509cf929"},{"index":[],"kind":"file","mode":420,"path":"completion-policy.json","sha256":"22f26a7ec7033998fe6202594d8e1ec0ff4650696dd54b6057b1272cc0e907c3"},{"index":[],"kind":"file","mode":493,"path":"init.sh","sha256":"1beb1cbd4b7eeb4ec1400b8226f883f6fbf284e5ba7031f0be963bc6d93b3816"},{"index":[],"kind":"file","mode":420,"path":"marker.txt","sha256":"ed1a545bb85e55816bbf9566b028b2a0bc456b88f49f6f266c0401048824194b"},{"index":[],"kind":"file","mode":493,"path":"orchestrator.py","sha256":"04ae19f06d89f808fb70eba44917a304b3d0301a96b6871ebb3f24f83af24bcd"},{"index":[],"kind":"file","mode":420,"path":"prompts/continue.md","sha256":"2165652bc769168a3002108f34de709cd73747e6c69f625a2674ce2cb3e18392"},{"index":[],"kind":"file","mode":420,"path":"prompts/evaluate.md","sha256":"cc011977d2296fbe8a67dee626400bedc478bf3ad2b3b187c5fc01fa05077bde"},{"index":[],"kind":"file","mode":420,"path":"prompts/plan.md","sha256":"c3b9bc6a8d2da152339180e3dc7e0fe9e1ef8912c252bac1b16874f94b566315"},{"index":[],"kind":"file","mode":420,"path":"prompts/work-fast.md","sha256":"a0fce937aee8d2cba2fbd269ccada5c375cb3d0605cfa5c4d615281a98b79e51"},{"index":[],"kind":"file","mode":420,"path":"prompts/work.md","sha256":"50ed19c1ec24e9e7e488ebec8c4374a6e7e7a7ca567c146474350b753b5026f6"},{"index":[],"kind":"file","mode":420,"path":"schemas/evaluation.schema.json","sha256":"12ac1ea98fef517fa54d0dcee8b85e65460d13d83079546031b77226495ab5d9"},{"index":[],"kind":"file","mode":420,"path":"schemas/feature_list.schema.json","sha256":"dcb780908c02fd3ee1a960c2ffcd9bf3b7cc33d36d311741ada6b07626a00d41"},{"index":[],"kind":"file","mode":420,"path":"schemas/receipt.schema.json","sha256":"f3108131c7dd274ac4464ff677257514c797852cd7f32cce7e363c0b2b925e99"},{"index":[],"kind":"file","mode":420,"path":"schemas/run.schema.json","sha256":"a98b100ba192c1657f8708b84a76c7463942208ad3969dbe5d00bbf3a1eb6eca"},{"index":[],"kind":"file","mode":420,"path":"scripts/__pycache__/completion.cpython-314.pyc","sha256":"0d05d1b1fe462e3de90fed918eb701d213a5b4dba893e142b30680108bebad3a"},{"index":[],"kind":"file","mode":420,"path":"scripts/__pycache__/completion_evaluator.cpython-314.pyc","sha256":"1aac904fe99f6503b20556fee9bf5795d9306ef14dfce2d8dc2ae4d7db0c470d"},{"index":[],"kind":"file","mode":420,"path":"scripts/__pycache__/human-eval.cpython-314.pyc","sha256":"03da744e22408219c9b11c203accb914876998f939d7295dc601ddd8d6cf67b5"},{"index":[],"kind":"file","mode":420,"path":"scripts/__pycache__/run_evidence.cpython-314.pyc","sha256":"7575820a369ce8e9b5ea6dc21123564b1cfad47b78d1fb0216bc6355be847f6d"},{"index":[],"kind":"file","mode":420,"path":"scripts/__pycache__/smoke-completion-provider.cpython-314.pyc","sha256":"f411072f7ba14788e21ba7d1acbbfa3b3e404e0fc957c3472e1465d10882abeb"},{"index":[],"kind":"file","mode":493,"path":"scripts/check-evaluator-evidence.sh","sha256":"38ae5908e4472a42e395c54a4afaf09dfc12229ed8c048c8ae318584ed48b550"},{"index":[],"kind":"file","mode":493,"path":"scripts/check-failure-domains.sh","sha256":"de918bb12da4adabe816ea724c7a74bfaad843141ec28e88d7bb059760e50706"},{"index":[],"kind":"file","mode":493,"path":"scripts/clean-state.py","sha256":"1a511c3e9189dd84e856acd9f7103c0b8c7cc5894e9ac5c1166b39f4adc2fb8e"},{"index":[],"kind":"file","mode":420,"path":"scripts/completion.py","sha256":"745d2da0e7610dac8b7168ab149ae67ed2446aa115b077121bb1b813f40cf0f1"},{"index":[],"kind":"file","mode":420,"path":"scripts/completion_evaluator.py","sha256":"ee2b5545defc746111b0e6812b801ead9ff09bf52b40db9c6504b30ab0aa3b3a"},{"index":[],"kind":"file","mode":493,"path":"scripts/human-eval.py","sha256":"2154614e74565077586da7d51e8439044e8e3509de05be61f2ff7eaa043cb760"},{"index":[],"kind":"file","mode":493,"path":"scripts/init.sh","sha256":"9ddd67613deaa81e711059e0b2ef32a6db537e629844ee4f85b69d10873914d1"},{"index":[],"kind":"file","mode":493,"path":"scripts/run-agent-provider.py","sha256":"3fb4322c81027a40621a61a22af5211968ec982ddcdac97c0fab0a2919973d74"},{"index":[],"kind":"file","mode":493,"path":"scripts/run-coding-agent.sh","sha256":"386f4813de9ed141e426589b26e575b454c8e157fc2c72bb1e94596d0397fe1b"},{"index":[],"kind":"file","mode":493,"path":"scripts/run-evaluator-agent.sh","sha256":"6611a4088bb823a1c7e41947aea3859299f8e871f2865e2615da852416f6b7bc"},{"index":[],"kind":"file","mode":420,"path":"scripts/run_evidence.py","sha256":"3af1420fba57640cdd990fa4dac751b8421c756da46a67d76c6f86ec0079c7e2"},{"index":[],"kind":"file","mode":420,"path":"scripts/smoke-completion-provider.py","sha256":"acd2c1a0c52b51fb12e50cd417ea7bb7044175cb13fce4bc1a555426f4f737cf"},{"index":[],"kind":"file","mode":493,"path":"scripts/summarize-progress.sh","sha256":"9b244c5cc3c194164a71b474cfcbc202d891915b6f83341997e31eafd7725bc9"},{"index":[],"kind":"file","mode":493,"path":"scripts/summarize-runs.sh","sha256":"15e88ce08aacc040350e3abead5267c8f5694d82de819a0636dc829b00fca0fc"},{"index":[],"kind":"file","mode":493,"path":"scripts/validate-feature.sh","sha256":"e54de27390f70a1cc920181af05fd6d54bf1113eb0e9a428020bc87033860964"},{"index":[],"kind":"file","mode":493,"path":"scripts/validate-state.py","sha256":"16432c0f60025163dda0bf36a70a4da3929d09409388bab1eed68991242bfe5f"}],"layout":"visible","policy":"git-source-v1","sha256":"ab9fa229a50118c5e8e47a8f4589166fa6890c06a4173800b8593af09352f6e6"}},"schema_version":1,"sha256":"2db2f8b877fdd600807c63eee6ca9bdd461a099ee23adc42a2281d63e2786705"}
